{
  "schemaVersion": "haifa.customer-demo-v2.evidence-instance/v1",
  "demoId": "DEMO-V2",
  "contractRef": "contracts/customer-demo-v2/v2-evidence-contract.json",
  "contractSha256": "3e777394ae279d4168605527422443627061269c7ed99c22771b5223cdbb0728",
  "generatedAt": "2026-09-29T00:00:00+08:00",
  "pins": {
    "mainSha": null,
    "sdkCommit": null,
    "sdkBomSha256": null,
    "customersCsvSha256": "ec326b7d0cf68f660ed769f8eecf9b71b43137af4e9aa83de75aa75bc5302f00",
    "reportingPolicySha256": "563e216fc77f87d968b3c34994746fa1f3368380ede30c97e03782c3895a9e9a",
    "caseOracleSha256": "d38cbc6f62a203643fd1e215067b0264781b3e38e24ec3e78250053714662930",
    "sourceIndexSha256": "49cd4020e6e8bab989438fb82451ea4dba08db89eb9c274642992aa2b0c3a3f0",
    "contractSha256": "3e777394ae279d4168605527422443627061269c7ed99c22771b5223cdbb0728"
  },
  "humanPilotDeclaration": null,
  "stageResults": [
    {
      "stage": "V2-M1",
      "result": "NOT_RUN"
    },
    {
      "stage": "V2-M2",
      "result": "NOT_RUN"
    },
    {
      "stage": "V2-M3",
      "result": "NOT_RUN"
    },
    {
      "stage": "V2-M4",
      "result": "NOT_RUN"
    },
    {
      "stage": "V2-M5",
      "result": "NOT_RUN"
    },
    {
      "stage": "V2-M6",
      "result": "NOT_RUN"
    }
  ],
  "caseResults": [
    {
      "id": "V2-M1-01",
      "stage": "V2-M1",
      "workPackage": "W03",
      "level": "L2",
      "backend": "haifa",
      "result": "NOT_RUN",
      "evidence": null
    },
    {
      "id": "V2-M1-02",
      "stage": "V2-M1",
      "workPackage": "W03",
      "level": "L2",
      "backend": "haifa",
      "result": "NOT_RUN",
      "evidence": null
    },
    {
      "id": "V2-M1-03",
      "stage": "V2-M1",
      "workPackage": "W04",
      "level": "L2",
      "backend": "haifa",
      "result": "NOT_RUN",
      "evidence": null
    },
    {
      "id": "V2-M1-04",
      "stage": "V2-M1",
      "workPackage": "W04",
      "level": "L2",
      "backend": "haifa",
      "result": "NOT_RUN",
      "evidence": null
    },
    {
      "id": "V2-M1-05",
      "stage": "V2-M1",
      "workPackage": "W04",
      "level": "L2",
      "backend": "haifa",
      "result": "NOT_RUN",
      "evidence": null
    },
    {
      "id": "V2-M1-06",
      "stage": "V2-M1",
      "workPackage": "W04",
      "level": "L2",
      "backend": "haifa",
      "result": "NOT_RUN",
      "evidence": null
    },
    {
      "id": "V2-M2-01",
      "stage": "V2-M2",
      "workPackage": "W10",
      "level": "L1",
      "backend": "haifa",
      "result": "NOT_RUN",
      "evidence": null
    },
    {
      "id": "V2-M2-02",
      "stage": "V2-M2",
      "workPackage": "W10",
      "level": "L1",
      "backend": "haifa",
      "result": "NOT_RUN",
      "evidence": null
    },
    {
      "id": "V2-M2-03",
      "stage": "V2-M2",
      "workPackage": "W10",
      "level": "L1",
      "backend": "haifa",
      "result": "NOT_RUN",
      "evidence": null
    },
    {
      "id": "V2-M2-04",
      "stage": "V2-M2",
      "workPackage": "W10",
      "level": "L2",
      "backend": "haifa",
      "result": "NOT_RUN",
      "evidence": null
    },
    {
      "id": "V2-M2-05",
      "stage": "V2-M2",
      "workPackage": "W10",
      "level": "L2",
      "backend": "haifa",
      "result": "NOT_RUN",
      "evidence": null
    },
    {
      "id": "V2-M2-06",
      "stage": "V2-M2",
      "workPackage": "W10",
      "level": "L1",
      "backend": "haifa",
      "result": "NOT_RUN",
      "evidence": null
    },
    {
      "id": "V2-M2-07",
      "stage": "V2-M2",
      "workPackage": "W10",
      "level": "L1",
      "backend": "haifa",
      "result": "NOT_RUN",
      "evidence": null
    },
    {
      "id": "V2-M2-08",
      "stage": "V2-M2",
      "workPackage": "W10",
      "level": "L2",
      "backend": "haifa",
      "result": "NOT_RUN",
      "evidence": null
    },
    {
      "id": "V2-M2-09",
      "stage": "V2-M2",
      "workPackage": "W10",
      "level": "L1",
      "backend": "haifa",
      "result": "NOT_RUN",
      "evidence": null
    },
    {
      "id": "V2-M2-10",
      "stage": "V2-M2",
      "workPackage": "W10",
      "level": "L1",
      "backend": "haifa",
      "result": "NOT_RUN",
      "evidence": null
    },
    {
      "id": "V2-M2-11",
      "stage": "V2-M2",
      "workPackage": "W10",
      "level": "L2",
      "backend": "haifa",
      "result": "NOT_RUN",
      "evidence": null
    },
    {
      "id": "V2-M2-12",
      "stage": "V2-M2",
      "workPackage": "W15",
      "level": "L1",
      "backend": "haifa",
      "result": "NOT_RUN",
      "evidence": null
    },
    {
      "id": "V2-M2-13",
      "stage": "V2-M2",
      "workPackage": "W15",
      "level": "L1",
      "backend": "haifa",
      "result": "NOT_RUN",
      "evidence": null
    },
    {
      "id": "V2-M2-14",
      "stage": "V2-M2",
      "workPackage": "W15",
      "level": "L1",
      "backend": "haifa",
      "result": "NOT_RUN",
      "evidence": null
    },
    {
      "id": "V2-M2-15",
      "stage": "V2-M2",
      "workPackage": "W15",
      "level": "L2",
      "backend": "haifa",
      "result": "NOT_RUN",
      "evidence": null
    },
    {
      "id": "V2-M2-16",
      "stage": "V2-M2",
      "workPackage": "W15",
      "level": "L1",
      "backend": "haifa",
      "result": "NOT_RUN",
      "evidence": null
    },
    {
      "id": "V2-M2-17",
      "stage": "V2-M2",
      "workPackage": "W15",
      "level": "L1",
      "backend": "haifa",
      "result": "NOT_RUN",
      "evidence": null
    },
    {
      "id": "V2-M3-01",
      "stage": "V2-M3",
      "workPackage": "W05",
      "level": "L2",
      "backend": "haifa",
      "result": "NOT_RUN",
      "evidence": null
    },
    {
      "id": "V2-M3-02",
      "stage": "V2-M3",
      "workPackage": "W05",
      "level": "L2",
      "backend": "haifa",
      "result": "NOT_RUN",
      "evidence": null
    },
    {
      "id": "V2-M3-03",
      "stage": "V2-M3",
      "workPackage": "W05",
      "level": "L2",
      "backend": "haifa",
      "result": "NOT_RUN",
      "evidence": null
    },
    {
      "id": "V2-M3-04",
      "stage": "V2-M3",
      "workPackage": "W16",
      "level": "L2",
      "backend": "haifa",
      "result": "NOT_RUN",
      "evidence": null
    },
    {
      "id": "V2-M3-05",
      "stage": "V2-M3",
      "workPackage": "W05",
      "level": "L2",
      "backend": "haifa",
      "result": "NOT_RUN",
      "evidence": null
    },
    {
      "id": "V2-M3-06",
      "stage": "V2-M3",
      "workPackage": "W05",
      "level": "L2",
      "backend": "haifa",
      "result": "NOT_RUN",
      "evidence": null
    },
    {
      "id": "V2-M3-07",
      "stage": "V2-M3",
      "workPackage": "W05",
      "level": "L2",
      "backend": "haifa",
      "result": "NOT_RUN",
      "evidence": null
    },
    {
      "id": "V2-M3-08",
      "stage": "V2-M3",
      "workPackage": "W05",
      "level": "L2",
      "backend": "haifa",
      "result": "NOT_RUN",
      "evidence": null
    },
    {
      "id": "V2-M3-09",
      "stage": "V2-M3",
      "workPackage": "W05",
      "level": "L2",
      "backend": "haifa",
      "result": "NOT_RUN",
      "evidence": null
    },
    {
      "id": "V2-M3-10",
      "stage": "V2-M3",
      "workPackage": "W05",
      "level": "L2",
      "backend": "haifa",
      "result": "NOT_RUN",
      "evidence": null
    },
    {
      "id": "V2-M4-01",
      "stage": "V2-M4",
      "workPackage": "W05",
      "level": "L2",
      "backend": "haifa",
      "result": "NOT_RUN",
      "evidence": null
    },
    {
      "id": "V2-M4-02",
      "stage": "V2-M4",
      "workPackage": "W05",
      "level": "L2",
      "backend": "haifa",
      "result": "NOT_RUN",
      "evidence": null
    },
    {
      "id": "V2-M4-03",
      "stage": "V2-M4",
      "workPackage": "W05",
      "level": "L2",
      "backend": "haifa",
      "result": "NOT_RUN",
      "evidence": null
    },
    {
      "id": "V2-M4-04",
      "stage": "V2-M4",
      "workPackage": "W05",
      "level": "L2",
      "backend": "haifa",
      "result": "NOT_RUN",
      "evidence": null
    },
    {
      "id": "V2-M4-05",
      "stage": "V2-M4",
      "workPackage": "W05",
      "level": "L2",
      "backend": "haifa",
      "result": "NOT_RUN",
      "evidence": null
    },
    {
      "id": "V2-M4-06",
      "stage": "V2-M4",
      "workPackage": "W21",
      "level": "L2",
      "backend": "haifa",
      "result": "NOT_RUN",
      "evidence": null
    },
    {
      "id": "V2-M4-07",
      "stage": "V2-M4",
      "workPackage": "W21",
      "level": "L2",
      "backend": "haifa",
      "result": "NOT_RUN",
      "evidence": null
    },
    {
      "id": "V2-M5-01",
      "stage": "V2-M5",
      "workPackage": "W18",
      "level": "L2",
      "backend": "haifa",
      "result": "NOT_RUN",
      "evidence": null
    },
    {
      "id": "V2-M5-02",
      "stage": "V2-M5",
      "workPackage": "W18",
      "level": "L2",
      "backend": "haifa",
      "result": "NOT_RUN",
      "evidence": null
    },
    {
      "id": "V2-M5-03",
      "stage": "V2-M5",
      "workPackage": "W18",
      "level": "L2",
      "backend": "haifa",
      "result": "NOT_RUN",
      "evidence": null
    },
    {
      "id": "V2-M5-04",
      "stage": "V2-M5",
      "workPackage": "W18",
      "level": "L2",
      "backend": "haifa",
      "result": "NOT_RUN",
      "evidence": null
    },
    {
      "id": "V2-M6-01",
      "stage": "V2-M6",
      "workPackage": "W24",
      "level": "L3",
      "backend": "haifa",
      "result": "NOT_RUN",
      "evidence": null
    },
    {
      "id": "V2-M6-02",
      "stage": "V2-M6",
      "workPackage": "W24",
      "level": "L3",
      "backend": "haifa",
      "result": "NOT_RUN",
      "evidence": null
    },
    {
      "id": "V2-M6-03",
      "stage": "V2-M6",
      "workPackage": "W24",
      "level": "L3",
      "backend": "haifa",